"id","screen_name","date","retweet_count","favorite_count","text","url","user_name","user_screen_name","user_description","user_profile_image_url","user_followers_count","user_friends_count","user_favourites_count","user_statuses_count","retweeted_status","sensitive",ContentModeration,sentiments,Emotion
"1171933943236583426","NetEnrich","9/11/2019 11:50:00 PM","0","0","Tools &amp; expertise for enterprises that quickly spin up a #DevOps environment ready to develop, build, test &amp; deploy… https://t.co/BDR1IrIoU9","https://twitter.com/NetEnrich/status/1171933943236583426","NetEnrich","NetEnrich","Fast track your #DigitalTransformation with our next-gen, platform-driven, outcome-based services. #AZURE #CloudMigration #DCM #NOC #CyberSecurity #BDR","http://pbs.twimg.com/profile_images/935067116889182209/6LNMDqMm_normal.jpg","1957","3068","1487","7228",,"False",No Review Required,0.901577055454254,No face detected
"1171933708254924802","Softtek","9/11/2019 11:49:04 PM","0","0","Our #Softtekians from Chile presenting success stories of our solution on #Azure cloud! #CloudComputing #Microsoft… https://t.co/DPaZVv44YB","https://twitter.com/Softtek/status/1171933708254924802","Softtek","Softtek","Official Twitter account for Softtek. We create value through technology to help organizations bridge the digital gap.","http://pbs.twimg.com/profile_images/1145720610422743043/JyGaSVW1_normal.png","5203","828","2019","24417",,"False",No Review Required,0.5,No face detected
"1171933499814756353","SOAzure","9/11/2019 11:48:14 PM","0","0","Azure Traffic Manager with OpenId Connect #azure https://t.co/oBSCYyO3RG","https://twitter.com/SOAzure/status/1171933499814756353","SO Azure","SOAzure","Automatically tweet the newest questions from StackOverflow & ServerFault that are tagged 'azure'. Not affiliated w/ StackOverflow or Microsoft Azure in any way","http://pbs.twimg.com/profile_images/1062001336001196032/UGITJmWG_normal.jpg","225","0","0","86920",,"False",No Review Required,0.5,No face detected
"1171936482426327040","luisp_flores","9/12/2019 12:00:05 AM","0","0","Save big on your #Azure services by purchasing reservations; now with upfront or monthly payments at no additional… https://t.co/UgV8bX3CX5","https://twitter.com/luisp_flores/status/1171936482426327040","Luis Flores","luisp_flores","Cloud Solution Architect at Microsoft","http://pbs.twimg.com/profile_images/1092108890349592576/dVV5bGLj_normal.jpg","164","102","273","4774",,"False",No Review Required,0.677074193954468,Happiness: 75%
"1171937756827791360","FrPSUG","9/12/2019 12:05:09 AM","0","0","Don't miss @BenoitSautiere talk: ""Manage Azure at large scale with Powershell  Notes from the Field"" on 10/12/2019… https://t.co/oJGjEvwCQt","https://twitter.com/FrPSUG/status/1171937756827791360","French PowerShell UG","FrPSUG","Groupe d'utilisateurs PowerShell Francophone. Managed by @lazywinadmin / @stephanevg / @omiossec_med / @irontux","http://pbs.twimg.com/profile_images/830839697672982529/VKQrkzAB_normal.jpg","307","131","189","240",,"False",No Review Required,0.237638652324677,No face detected
